{
  "schemaVersion": 2,
  "track": "portable-bridge-v1",
  "architectureRevision": "portable-components-1",
  "experiment": "C-source-bridge",
  "treatment": "portable-default",
  "version": {
    "major": 20,
    "angular": "20.3.0",
    "cli": "20.3.0",
    "typescript": "5.9.3",
    "node": "22.23.2",
    "zone": "0.15.1"
  },
  "componentGraph": [
    "Shell",
    "Toolbar",
    "Table",
    "AssetRow",
    "Summary",
    "Chart",
    "Details"
  ],
  "state": "immutable publications + dependency-aware imperative selectors",
  "publication": "touched snapshots; all snapshots for array mode, including unchanged clones",
  "equality": "Object.is; no custom comparator",
  "selectors": "full aggregate once per tick; static filter/symbol order independent of prices",
  "changeDetection": "framework-default",
  "flow": "ngFor/ngIf",
  "scheduler": "zone",
  "builder": "@angular-devkit/build-angular:browser",
  "recipe": "controlled-webpack-portable-bridge-v1",
  "delivery": "serial-lossless",
  "diagnostic": false,
  "signalInputs": false
}
