{
  "schemaVersion": 2,
  "track": "idiomatic-v2",
  "architectureRevision": "market-components-1",
  "experiment": "B-runtime",
  "treatment": "idiomatic-v2",
  "version": {
    "major": 20,
    "angular": "20.3.0",
    "cli": "20.3.0",
    "typescript": "5.9.3",
    "node": "22.23.2",
    "zone": "0.15.1"
  },
  "componentGraph": [
    "Shell",
    "Toolbar",
    "Table",
    "AssetRow",
    "Summary",
    "Chart",
    "Details"
  ],
  "state": "per-entity signal + computed",
  "publication": "touched snapshots; all snapshots for array mode, including unchanged clones",
  "equality": "Object.is; no custom comparator",
  "selectors": "full aggregate once per tick; static filter/symbol order independent of prices",
  "changeDetection": "OnPush",
  "flow": "@for/@if",
  "scheduler": "zoneless",
  "builder": "@angular-devkit/build-angular:browser",
  "recipe": "controlled-webpack-v1",
  "delivery": "serial-lossless",
  "diagnostic": false,
  "signalInputs": false
}
